Code,Product Name,Dimensions,Specification,Qty
COSTA-001,Chair,590x580x830,"Solid ASH WOOD frame with PU lacquer finish. Seat and back in fabric upholstery. Fabric spec: SUNBURY DESIGN HESKETH CREED 2827 OR EQUIVALENT.",1
COSTA-002,Table,600x600x750,"Top: veneer on 25MM MDF backing. Base: loose metal base with powder coat finish. Spider plate 300x300x3mm.",1
COSTA-003,Marble Round Table,DIA 600 x 750,"Top: natural stone/marble on 18MM thick ply backing. Base: loose metal base with powder coat finish.",1
COSTA-004,Round Table with Laminate,DIA 600 x 745,"Top: laminate finish on 25MM MDF. Base: loose metal base with powder coat / MS pipe 58mm.",1
COSTA-005,Double Bin,1200x400,"Top: stone with wire support. Plywood base cabinet with laminate finish. PP included.",1
COSTA-006,Side Storage,1200x400,"Top: stone with wire support. Plywood base cabinet with laminate finish.",1
COSTA-007,Sofa,2000x690x960,"Plywood laminated base structure. Seat and back in fabric upholstery. Fabric spec: SUNBURY DESIGN HESKETH CREED 2827 OR EQUIVALENT. Electrical provision included.",1
